{
  "id": "8dc852e3-9d0d-446b-8830-c6f53516f639",
  "name": "Field background color",
  "author": "Fiberflow <fiberflow.io@gmail.com> (https://fiberflow.io)",
  "description": "Set the background color of a field.",
  "version": "1.0.0",
  "keywords": ["Fields", "Color"],
  "parameters": {
    "fields": [
      {
        "color": "#BFF3E9"
      }
    ]
  },
  "parametersDef": {
    "id": "8dc852e3-9d0d-446b-8830-c6f53516f639-params",
    "type": "object",
    "properties": {
      "fields": {
        "id": "a1b2c3d4-e5f6-7890-abcd-ef1234567890",
        "label": "Fields",
        "type": "array",
        "items": {
          "id": "a1b2c3d4-e5f6-7890-abcd-ef1234567891",
          "type": "object",
          "properties": {
            "fieldId": {
              "id": "b2c3d4e5-f6a7-8901-bcde-f23456789012",
              "type": "fibery-field",
              "label": "Field",
              "position": 1
            },
            "color": {
              "id": "c3d4e5f6-a7b8-9012-cdef-345678901234",
              "type": "color",
              "label": "Color",
              "position": 2
            },
            "fontSize": {
              "id": "d4e5f6a7-b8c9-0123-defa-456789012345",
              "type": "number",
              "label": "Font size",
              "position": 3
            },
            "fontWeight": {
              "id": "e5f6a7b8-c9d0-1234-efab-567890123456",
              "type": "number",
              "label": "Font weight",
              "position": 4
            },
            "textAlign": {
              "id": "f6a7b8c9-d0e1-2345-fabc-678901234567",
              "type": "enum",
              "label": "Text align",
              "options": ["left", "center", "right"],
              "position": 5
            }
          }
        }
      }
    }
  }
}
